{"schema_version":1,"event_id":"event-7","event_type":"vendor.future_event","event_class":"informational","aggregate":{"kind":"attempt","id":"attempt-9","sequence":5},"command_id":"cmd-start-02","causation_id":null,"actor_id":"actor-3","ownership_generation":1,"occurred_at_unix_ms":1700000000006,"snapshot_cursor":"cursor-20","payload":{"vendor":{"opaque":true}}}
